{
  "$schema": "https://json-schema.org/draft/2020-12/schema",
  "title": "Hyperion federated release catalog",
  "type": "object",
  "additionalProperties": false,
  "required": ["$schema", "schemaVersion", "cell", "catalogVersion", "owner", "createdAt", "components"],
  "properties": {
    "$schema": {
      "const": "../../schemas/release-catalog.schema.json"
    },
    "schemaVersion": {
      "const": 1
    },
    "cell": {
      "enum": ["platform", "nova", "lumen", "pulso"]
    },
    "catalogVersion": {
      "$ref": "#/$defs/semver"
    },
    "owner": {
      "type": "string",
      "pattern": "^@[A-Za-z0-9](?:[A-Za-z0-9-]{0,37}[A-Za-z0-9])?$"
    },
    "createdAt": {
      "type": "string",
      "format": "date-time"
    },
    "rollbackPolicy": {
      "type": "string",
      "pattern": "^releases/rollback-policies/(?:nova|lumen|pulso)/(0|[1-9][0-9]*)\\.(0|[1-9][0-9]*)\\.(0|[1-9][0-9]*)(?:-[0-9A-Za-z-]+(?:\\.[0-9A-Za-z-]+)*)?(?:\\+[0-9A-Za-z-]+(?:\\.[0-9A-Za-z-]+)*)?\\.json$"
    },
    "rollbackPolicySha256": {
      "type": "string",
      "pattern": "^(?!0{64}$)[a-f0-9]{64}$"
    },
    "components": {
      "type": "array",
      "minItems": 1,
      "items": {
        "$ref": "#/$defs/component"
      }
    }
  },
  "allOf": [
    {
      "if": {
        "required": ["rollbackPolicy"]
      },
      "then": {
        "required": ["rollbackPolicySha256"]
      }
    },
    {
      "if": {
        "required": ["rollbackPolicySha256"]
      },
      "then": {
        "required": ["rollbackPolicy"]
      }
    }
  ],
  "$defs": {
    "semver": {
      "type": "string",
      "pattern": "^(0|[1-9][0-9]*)\\.(0|[1-9][0-9]*)\\.(0|[1-9][0-9]*)(?:-[0-9A-Za-z-]+(?:\\.[0-9A-Za-z-]+)*)?(?:\\+[0-9A-Za-z-]+(?:\\.[0-9A-Za-z-]+)*)?$"
    },
    "component": {
      "type": "object",
      "additionalProperties": false,
      "required": ["id", "kind", "distribution", "sourcePath", "versionSource", "version"],
      "properties": {
        "id": {
          "type": "string",
          "pattern": "^[a-z][a-z0-9]*(?:-[a-z0-9]+)*$"
        },
        "kind": {
          "enum": ["service", "gateway", "bff", "console", "migrations", "contract"]
        },
        "distribution": {
          "enum": ["oci", "npm"]
        },
        "sourcePath": {
          "type": "string",
          "pattern": "^[A-Za-z0-9._-]+(?:/[A-Za-z0-9._-]+)*$"
        },
        "versionSource": {
          "type": "string",
          "pattern": "^[A-Za-z0-9._-]+(?:/[A-Za-z0-9._-]+)*/package\\.json$"
        },
        "version": {
          "$ref": "#/$defs/semver"
        },
        "imageRepository": {
          "type": "string",
          "pattern": "^[a-z0-9]+(?:[._-][a-z0-9]+)*(?::[1-9][0-9]*)?(?:/[a-z0-9]+(?:[._-][a-z0-9]+)*)+$"
        },
        "buildService": {
          "type": "string",
          "pattern": "^[a-z][a-z0-9]*(?:-[a-z0-9]+)*$"
        },
        "composeServices": {
          "type": "array",
          "minItems": 1,
          "uniqueItems": true,
          "items": {
            "type": "string",
            "pattern": "^[a-z][a-z0-9]*(?:-[a-z0-9]+)*$"
          }
        },
        "packageName": {
          "type": "string",
          "pattern": "^(?:@[a-z0-9][a-z0-9._-]*/)?[a-z0-9][a-z0-9._-]*$"
        }
      },
      "allOf": [
        {
          "if": {
            "properties": {
              "distribution": {
                "const": "oci"
              }
            }
          },
          "then": {
            "required": ["imageRepository"],
            "not": {
              "required": ["packageName"]
            }
          }
        },
        {
          "if": {
            "properties": {
              "distribution": {
                "const": "npm"
              }
            }
          },
          "then": {
            "required": ["packageName"],
            "properties": {
              "kind": {
                "const": "contract"
              }
            },
            "not": {
              "anyOf": [
                {
                  "required": ["imageRepository"]
                },
                {
                  "required": ["buildService"]
                },
                {
                  "required": ["composeServices"]
                }
              ]
            }
          }
        },
        {
          "if": {
            "required": ["composeServices"]
          },
          "then": {
            "required": ["buildService"]
          }
        },
        {
          "if": {
            "properties": {
              "kind": {
                "const": "contract"
              }
            }
          },
          "then": {
            "properties": {
              "distribution": {
                "const": "npm"
              }
            }
          }
        }
      ]
    }
  }
}
