{
  "$schema": "../../schemas/release-catalog.schema.json",
  "schemaVersion": 1,
  "cell": "platform",
  "catalogVersion": "2.4.0",
  "owner": "@HyperionPrivate/platform",
  "createdAt": "2026-07-22T23:45:00Z",
  "components": [
    {
      "id": "identity-service", "kind": "service", "distribution": "oci",
      "sourcePath": "services/identity-service", "versionSource": "services/identity-service/package.json",
      "version": "0.3.0", "imageRepository": "ghcr.io/hyperionprivate/identity-service"
    },
    {
      "id": "tenant-service", "kind": "service", "distribution": "oci",
      "sourcePath": "services/tenant-service", "versionSource": "services/tenant-service/package.json",
      "version": "0.1.0", "imageRepository": "ghcr.io/hyperionprivate/tenant-service"
    },
    {
      "id": "audit-service", "kind": "service", "distribution": "oci",
      "sourcePath": "services/audit-service", "versionSource": "services/audit-service/package.json",
      "version": "0.1.0", "imageRepository": "ghcr.io/hyperionprivate/audit-service"
    },
    {
      "id": "access-migrations", "kind": "migrations", "distribution": "oci",
      "sourcePath": "packages/access-migrations", "versionSource": "packages/access-migrations/package.json",
      "version": "1.2.0", "imageRepository": "ghcr.io/hyperionprivate/access-migrations",
      "buildService": "access-migrations",
      "composeServices": ["access-database-bootstrap", "access-migrations", "access-role-bootstrap"]
    },
    {
      "id": "audit-migrations", "kind": "migrations", "distribution": "oci",
      "sourcePath": "packages/audit-migrations", "versionSource": "packages/audit-migrations/package.json",
      "version": "1.0.0", "imageRepository": "ghcr.io/hyperionprivate/audit-migrations",
      "buildService": "audit-migrations",
      "composeServices": ["audit-database-bootstrap", "audit-migrations", "audit-role-bootstrap"]
    },
    {
      "id": "platform-admin-bff", "kind": "bff", "distribution": "oci",
      "sourcePath": "apps/platform-admin-bff", "versionSource": "apps/platform-admin-bff/package.json",
      "version": "1.0.0", "imageRepository": "ghcr.io/hyperionprivate/platform-admin-bff"
    },
    {
      "id": "platform-admin-console", "kind": "console", "distribution": "oci",
      "sourcePath": "apps/platform-admin-console", "versionSource": "apps/platform-admin-console/package.json",
      "version": "0.1.0", "imageRepository": "ghcr.io/hyperionprivate/platform-admin-console"
    },
    {
      "id": "platform-contracts", "kind": "contract", "distribution": "npm",
      "sourcePath": "packages/platform-contracts", "versionSource": "packages/platform-contracts/package.json",
      "version": "1.1.0", "packageName": "@hyperion/platform-contracts"
    },
    {
      "id": "audit-contracts", "kind": "contract", "distribution": "npm",
      "sourcePath": "packages/audit-contracts", "versionSource": "packages/audit-contracts/package.json",
      "version": "1.1.0", "packageName": "@hyperion/audit-contracts"
    }
  ]
}
