{
  "$schema": "../../schemas/release-catalog.schema.json",
  "schemaVersion": 1,
  "cell": "pulso",
  "catalogVersion": "1.4.0",
  "owner": "@AdministracionHyperion",
  "createdAt": "2026-07-20T19:45:00Z",
  "rollbackPolicy": "releases/rollback-policies/pulso/1.4.0.json",
  "rollbackPolicySha256": "9f742b2300003252dae2153c1da718d77853f1b804bd2eaaf7b4c5844a78b021",
  "components": [
    {
      "id": "agent-service", "kind": "service", "distribution": "oci",
      "sourcePath": "services/agent-service", "versionSource": "services/agent-service/package.json",
      "version": "0.2.0", "imageRepository": "ghcr.io/hyperionprivate/agent-service"
    },
    {
      "id": "prompt-flow-service", "kind": "service", "distribution": "oci",
      "sourcePath": "services/prompt-flow-service", "versionSource": "services/prompt-flow-service/package.json",
      "version": "0.2.0", "imageRepository": "ghcr.io/hyperionprivate/prompt-flow-service"
    },
    {
      "id": "knowledge-service", "kind": "service", "distribution": "oci",
      "sourcePath": "services/knowledge-service", "versionSource": "services/knowledge-service/package.json",
      "version": "0.2.0", "imageRepository": "ghcr.io/hyperionprivate/knowledge-service"
    },
    {
      "id": "integration-service", "kind": "service", "distribution": "oci",
      "sourcePath": "services/integration-service", "versionSource": "services/integration-service/package.json",
      "version": "0.2.0", "imageRepository": "ghcr.io/hyperionprivate/integration-service"
    },
    {
      "id": "pulso-iris-service", "kind": "service", "distribution": "oci",
      "sourcePath": "services/pulso-iris-service", "versionSource": "services/pulso-iris-service/package.json",
      "version": "0.2.0", "imageRepository": "ghcr.io/hyperionprivate/pulso-iris-service"
    },
    {
      "id": "whatsapp-channel-service", "kind": "service", "distribution": "oci",
      "sourcePath": "services/whatsapp-channel-service", "versionSource": "services/whatsapp-channel-service/package.json",
      "version": "0.3.0", "imageRepository": "ghcr.io/hyperionprivate/whatsapp-channel-service"
    },
    {
      "id": "pulso-bff", "kind": "bff", "distribution": "oci",
      "sourcePath": "apps/pulso-bff", "versionSource": "apps/pulso-bff/package.json",
      "version": "1.0.0", "imageRepository": "ghcr.io/hyperionprivate/pulso-bff"
    },
    {
      "id": "pulso-console", "kind": "console", "distribution": "oci",
      "sourcePath": "apps/pulso-console", "versionSource": "apps/pulso-console/package.json",
      "version": "0.1.0", "imageRepository": "ghcr.io/hyperionprivate/pulso-console"
    },
    {
      "id": "pulso-migrations", "kind": "migrations", "distribution": "oci",
      "sourcePath": "packages/pulso-migrations", "versionSource": "packages/pulso-migrations/package.json",
      "version": "1.3.0", "imageRepository": "ghcr.io/hyperionprivate/pulso-migrations",
      "buildService": "pulso-migrations",
      "composeServices": ["pulso-database-bootstrap", "pulso-migrations", "pulso-role-bootstrap"]
    },
    {
      "id": "pulso-contracts", "kind": "contract", "distribution": "npm",
      "sourcePath": "packages/pulso-contracts", "versionSource": "packages/pulso-contracts/package.json",
      "version": "1.1.0", "packageName": "@hyperion/pulso-contracts"
    }
  ]
}
