{
  "$schema": "../../schemas/release-catalog.schema.json",
  "schemaVersion": 1,
  "cell": "lumen",
  "catalogVersion": "1.0.0",
  "owner": "@AdministracionHyperion",
  "createdAt": "2026-07-17T00:00:00Z",
  "components": [
    {
      "id": "lumen-service",
      "kind": "service",
      "distribution": "oci",
      "sourcePath": "services/lumen-service",
      "versionSource": "services/lumen-service/package.json",
      "version": "0.1.0",
      "imageRepository": "ghcr.io/administracionhyperion/lumen-service"
    },
    {
      "id": "lumen-bff",
      "kind": "bff",
      "distribution": "oci",
      "sourcePath": "apps/lumen-bff",
      "versionSource": "apps/lumen-bff/package.json",
      "version": "1.0.0",
      "imageRepository": "ghcr.io/administracionhyperion/lumen-bff"
    },
    {
      "id": "lumen-console",
      "kind": "console",
      "distribution": "oci",
      "sourcePath": "apps/lumen-console",
      "versionSource": "apps/lumen-console/package.json",
      "version": "0.1.0",
      "imageRepository": "ghcr.io/administracionhyperion/lumen-console"
    },
    {
      "id": "lumen-contracts",
      "kind": "contract",
      "distribution": "npm",
      "sourcePath": "packages/lumen-contracts",
      "versionSource": "packages/lumen-contracts/package.json",
      "version": "1.0.0",
      "packageName": "@hyperion/lumen-contracts"
    }
  ]
}
