{
  "$schema": "../../schemas/release-catalog.schema.json",
  "schemaVersion": 1,
  "cell": "pulso",
  "catalogVersion": "1.0.0",
  "owner": "@AdministracionHyperion",
  "createdAt": "2026-07-17T00:00:00Z",
  "components": [
    {
      "id": "agent-service",
      "kind": "service",
      "distribution": "oci",
      "sourcePath": "services/agent-service",
      "versionSource": "services/agent-service/package.json",
      "version": "0.1.0",
      "imageRepository": "ghcr.io/administracionhyperion/agent-service"
    },
    {
      "id": "prompt-flow-service",
      "kind": "service",
      "distribution": "oci",
      "sourcePath": "services/prompt-flow-service",
      "versionSource": "services/prompt-flow-service/package.json",
      "version": "0.1.0",
      "imageRepository": "ghcr.io/administracionhyperion/prompt-flow-service"
    },
    {
      "id": "knowledge-service",
      "kind": "service",
      "distribution": "oci",
      "sourcePath": "services/knowledge-service",
      "versionSource": "services/knowledge-service/package.json",
      "version": "0.1.0",
      "imageRepository": "ghcr.io/administracionhyperion/knowledge-service"
    },
    {
      "id": "integration-service",
      "kind": "service",
      "distribution": "oci",
      "sourcePath": "services/integration-service",
      "versionSource": "services/integration-service/package.json",
      "version": "0.1.0",
      "imageRepository": "ghcr.io/administracionhyperion/integration-service"
    },
    {
      "id": "pulso-iris-service",
      "kind": "service",
      "distribution": "oci",
      "sourcePath": "services/pulso-iris-service",
      "versionSource": "services/pulso-iris-service/package.json",
      "version": "0.1.0",
      "imageRepository": "ghcr.io/administracionhyperion/pulso-iris-service"
    },
    {
      "id": "whatsapp-channel-service",
      "kind": "service",
      "distribution": "oci",
      "sourcePath": "services/whatsapp-channel-service",
      "versionSource": "services/whatsapp-channel-service/package.json",
      "version": "0.1.0",
      "imageRepository": "ghcr.io/administracionhyperion/whatsapp-channel-service"
    },
    {
      "id": "pulso-bff",
      "kind": "bff",
      "distribution": "oci",
      "sourcePath": "apps/pulso-bff",
      "versionSource": "apps/pulso-bff/package.json",
      "version": "1.0.0",
      "imageRepository": "ghcr.io/administracionhyperion/pulso-bff"
    },
    {
      "id": "pulso-console",
      "kind": "console",
      "distribution": "oci",
      "sourcePath": "apps/pulso-console",
      "versionSource": "apps/pulso-console/package.json",
      "version": "0.1.0",
      "imageRepository": "ghcr.io/administracionhyperion/pulso-console"
    },
    {
      "id": "pulso-contracts",
      "kind": "contract",
      "distribution": "npm",
      "sourcePath": "packages/pulso-contracts",
      "versionSource": "packages/pulso-contracts/package.json",
      "version": "1.0.0",
      "packageName": "@hyperion/pulso-contracts"
    }
  ]
}
